{
    "$schema": "https://json-schema.org/draft/2020-12/schema",
    "$id": "http://openmagnetics.com/schemas/MAS.json",
    "title": "MAS",
    "description": "All the data structure used in the Magnetic Agnostic Structure",
    "type": "object",
    "properties": {
        "masVersion":{
            "description": "SemVer version of the MAS specification this document conforms to (MAJOR.MINOR.PATCH). Optional in 0.x; will become required in 1.0.",
            "title": "MAS Version",
            "type": "string",
            "pattern": "^\\d+\\.\\d+\\.\\d+(?:-[0-9A-Za-z.-]+)?$",
            "examples": ["0.1.0", "1.0.0", "1.2.3-rc.1"]
        },
        "inputs":{
            "description": "The description of the inputs that can be used to design a Magnetic",
            "title": "Inputs",
            "$ref": "./inputs.json"
        },
        "magnetic":{
            "description": "The description of a magnetic",
            "title": "Magnetic",
            "$ref": "./magnetic.json"
        },
        "outputs":{
            "description": "The description of the outputs that are produced after designing a Magnetic",
            "title": "Outputs",
            "type": "array",
            "items": {                
                "$ref": "./outputs.json"
            }
        }
    },
    "required": ["inputs", "magnetic", "outputs"]
}