{
    "masVersion": "1.0.0",
    "inputs": {
        "designRequirements": {
            "name": "Single Switch Forward Transformer 400V to 24V 3A",
            "magnetizingInductance": {
                "nominal": 0.002,
                "minimum": 0.0018,
                "maximum": 0.0022
            },
            "turnsRatios": [
                {
                    "nominal": 1.0,
                    "minimum": 0.98,
                    "maximum": 1.02
                },
                {
                    "nominal": 0.075,
                    "minimum": 0.07,
                    "maximum": 0.08
                }
            ],
            "leakageInductance": [
                {
                    "maximum": 8e-06
                }
            ],
            "topology": "singleSwitchForwardConverter",
            "operatingTemperature": {
                "maximum": 100
            },
            "insulation": {
                "insulationType": "reinforced",
                "overvoltageCategory": "II",
                "pollutionDegree": "PD2",
                "altitude": {
                    "maximum": 2000
                },
                "cti": "groupIIIA"
            },
            "maximumDimensions": {
                "width": 0.04,
                "height": 0.035,
                "depth": 0.03
            }
        },
        "operatingPoints": [
            {
                "name": "Nominal Load",
                "conditions": {
                    "ambientTemperature": 40
                },
                "excitationsPerWinding": [
                    {
                        "name": "Primary",
                        "frequency": 150000,
                        "current": {
                            "processed": {
                                "label": "triangular",
                                "peakToPeak": 0.5,
                                "offset": 0.3,
                                "dutyCycle": 0.4
                            }
                        },
                        "voltage": {
                            "processed": {
                                "label": "rectangular",
                                "peakToPeak": 400,
                                "offset": 0,
                                "dutyCycle": 0.4
                            }
                        }
                    },
                    {
                        "name": "Reset Winding",
                        "frequency": 150000,
                        "current": {
                            "processed": {
                                "label": "triangular",
                                "peakToPeak": 0.5,
                                "offset": -0.3,
                                "dutyCycle": 0.4
                            }
                        },
                        "voltage": {
                            "processed": {
                                "label": "rectangular",
                                "peakToPeak": 400,
                                "offset": 0,
                                "dutyCycle": 0.4
                            }
                        }
                    },
                    {
                        "name": "Secondary",
                        "frequency": 150000,
                        "current": {
                            "processed": {
                                "label": "rectangular",
                                "peakToPeak": 0.6,
                                "offset": 3.0,
                                "dutyCycle": 0.4
                            }
                        },
                        "voltage": {
                            "processed": {
                                "label": "rectangular",
                                "peakToPeak": 30,
                                "offset": 0,
                                "dutyCycle": 0.4
                            }
                        }
                    }
                ]
            }
        ]
    },
    "magnetic": {
        "core": {
            "name": "RM 12 N97",
            "functionalDescription": {
                "type": "twoPieceSet",
                "material": "N97",
                "shape": "RM 12",
                "gapping": [],
                "numberStacks": 1
            }
        },
        "coil": {
            "bobbin": "RM 12",
            "functionalDescription": [
                {
                    "name": "Primary",
                    "numberTurns": 80,
                    "numberParallels": 1,
                    "isolationSide": "primary",
                    "wire": "Round 0.35 - Grade 1"
                },
                {
                    "name": "Reset Winding",
                    "numberTurns": 80,
                    "numberParallels": 1,
                    "isolationSide": "primary",
                    "wire": "Round 0.35 - Grade 1"
                },
                {
                    "name": "Secondary",
                    "numberTurns": 6,
                    "numberParallels": 3,
                    "isolationSide": "secondary",
                    "wire": "Litz 60x0.1 - Grade 1"
                }
            ]
        }
    },
    "outputs": []
}
