{
    "masVersion": "1.0.0",
    "inputs": {
        "designRequirements": {
            "name": "Push-Pull Transformer 48V to 12V 10A",
            "magnetizingInductance": {
                "nominal": 0.0008,
                "minimum": 0.0007,
                "maximum": 0.0009
            },
            "turnsRatios": [
                {
                    "nominal": 1.0,
                    "minimum": 0.98,
                    "maximum": 1.02
                },
                {
                    "nominal": 0.25,
                    "minimum": 0.24,
                    "maximum": 0.26
                },
                {
                    "nominal": 0.25,
                    "minimum": 0.24,
                    "maximum": 0.26
                }
            ],
            "topology": "pushPullConverter",
            "operatingTemperature": {
                "maximum": 100
            },
            "insulation": {
                "insulationType": "functional",
                "overvoltageCategory": "II",
                "pollutionDegree": "PD2"
            },
            "maximumDimensions": {
                "width": 0.045,
                "height": 0.04,
                "depth": 0.035
            }
        },
        "operatingPoints": [
            {
                "name": "Nominal Load",
                "conditions": {
                    "ambientTemperature": 40
                },
                "excitationsPerWinding": [
                    {
                        "name": "Primary 1",
                        "frequency": 100000,
                        "current": {
                            "processed": {
                                "label": "bipolarRectangular",
                                "peakToPeak": 3.0,
                                "offset": 0,
                                "dutyCycle": 0.45
                            }
                        },
                        "voltage": {
                            "processed": {
                                "label": "bipolarRectangular",
                                "peakToPeak": 96,
                                "offset": 0,
                                "dutyCycle": 0.45
                            }
                        }
                    },
                    {
                        "name": "Primary 2",
                        "frequency": 100000,
                        "current": {
                            "processed": {
                                "label": "bipolarRectangular",
                                "peakToPeak": 3.0,
                                "offset": 0,
                                "dutyCycle": 0.45
                            }
                        },
                        "voltage": {
                            "processed": {
                                "label": "bipolarRectangular",
                                "peakToPeak": 96,
                                "offset": 0,
                                "dutyCycle": 0.45
                            }
                        }
                    },
                    {
                        "name": "Secondary 1",
                        "frequency": 100000,
                        "current": {
                            "processed": {
                                "label": "rectangular",
                                "peakToPeak": 2.0,
                                "offset": 10.0,
                                "dutyCycle": 0.45
                            }
                        },
                        "voltage": {
                            "processed": {
                                "label": "rectangular",
                                "peakToPeak": 24,
                                "offset": 0,
                                "dutyCycle": 0.45
                            }
                        }
                    },
                    {
                        "name": "Secondary 2",
                        "frequency": 100000,
                        "current": {
                            "processed": {
                                "label": "rectangular",
                                "peakToPeak": 2.0,
                                "offset": 10.0,
                                "dutyCycle": 0.45
                            }
                        },
                        "voltage": {
                            "processed": {
                                "label": "rectangular",
                                "peakToPeak": 24,
                                "offset": 0,
                                "dutyCycle": 0.45
                            }
                        }
                    }
                ]
            }
        ]
    },
    "magnetic": {
        "core": {
            "name": "ETD 44/22/15 3C95",
            "functionalDescription": {
                "type": "twoPieceSet",
                "material": "3C95",
                "shape": "ETD 44/22/15",
                "gapping": [],
                "numberStacks": 1
            }
        },
        "coil": {
            "bobbin": "ETD 44/22/15",
            "functionalDescription": [
                {
                    "name": "Primary 1",
                    "numberTurns": 16,
                    "numberParallels": 1,
                    "isolationSide": "primary",
                    "wire": "Litz 60x0.1 - Grade 1"
                },
                {
                    "name": "Primary 2",
                    "numberTurns": 16,
                    "numberParallels": 1,
                    "isolationSide": "primary",
                    "wire": "Litz 60x0.1 - Grade 1"
                },
                {
                    "name": "Secondary 1",
                    "numberTurns": 4,
                    "numberParallels": 4,
                    "isolationSide": "secondary",
                    "wire": "Litz 100x0.1 - Grade 1"
                },
                {
                    "name": "Secondary 2",
                    "numberTurns": 4,
                    "numberParallels": 4,
                    "isolationSide": "secondary",
                    "wire": "Litz 100x0.1 - Grade 1"
                }
            ]
        }
    },
    "outputs": []
}
