{
    "masVersion": "1.0.0",
    "inputs": {
        "designRequirements": {
            "name": "Boost Inductor 12V to 48V",
            "magnetizingInductance": {
                "nominal": 4.7e-05,
                "minimum": 4.2e-05,
                "maximum": 5.2e-05
            },
            "turnsRatios": [],
            "topology": "boostConverter",
            "operatingTemperature": {
                "maximum": 100
            },
            "maximumDimensions": {
                "width": 0.025,
                "height": 0.02,
                "depth": 0.015
            }
        },
        "operatingPoints": [
            {
                "name": "Full Load 2A Output",
                "conditions": {
                    "ambientTemperature": 40
                },
                "excitationsPerWinding": [
                    {
                        "name": "Primary",
                        "frequency": 200000,
                        "current": {
                            "processed": {
                                "label": "triangular",
                                "peakToPeak": 2.4,
                                "offset": 8.0,
                                "dutyCycle": 0.75
                            }
                        },
                        "voltage": {
                            "processed": {
                                "label": "rectangular",
                                "peakToPeak": 48.0,
                                "offset": 0,
                                "dutyCycle": 0.75
                            }
                        }
                    }
                ]
            }
        ]
    },
    "magnetic": {
        "core": {
            "name": "PQ 20/16 N97 Gapped",
            "functionalDescription": {
                "type": "twoPieceSet",
                "material": "N97",
                "shape": "PQ 20/16",
                "gapping": [
                    {
                        "type": "subtractive",
                        "length": 0.0012
                    },
                    {
                        "type": "residual",
                        "length": 1e-05
                    },
                    {
                        "type": "residual",
                        "length": 1e-05
                    }
                ],
                "numberStacks": 1
            }
        },
        "coil": {
            "bobbin": "PQ 20/16",
            "functionalDescription": [
                {
                    "name": "Primary",
                    "numberTurns": 18,
                    "numberParallels": 2,
                    "isolationSide": "primary",
                    "wire": "Litz 40x0.1 - Grade 1"
                }
            ]
        }
    },
    "outputs": []
}
