{
    "masVersion": "1.0.0",
    "inputs": {
        "designRequirements": {
            "name": "Current Transformer 100A:1A",
            "magnetizingInductance": {
                "minimum": 1e-06
            },
            "turnsRatios": [
                {
                    "nominal": 100.0,
                    "minimum": 99.0,
                    "maximum": 101.0
                }
            ],
            "topology": "currentTransformer",
            "operatingTemperature": {
                "maximum": 85
            },
            "maximumDimensions": {
                "width": 0.03,
                "height": 0.025,
                "depth": 0.02
            }
        },
        "operatingPoints": [
            {
                "name": "Rated Current 50Hz",
                "conditions": {
                    "ambientTemperature": 25
                },
                "excitationsPerWinding": [
                    {
                        "name": "Primary",
                        "frequency": 50,
                        "current": {
                            "processed": {
                                "label": "sinusoidal",
                                "peakToPeak": 141.4,
                                "offset": 0,
                                "dutyCycle": 0.5
                            }
                        },
                        "voltage": {
                            "processed": {
                                "label": "sinusoidal",
                                "peakToPeak": 0.1,
                                "offset": 0,
                                "dutyCycle": 0.5
                            }
                        }
                    },
                    {
                        "name": "Secondary",
                        "frequency": 50,
                        "current": {
                            "processed": {
                                "label": "sinusoidal",
                                "peakToPeak": 1.414,
                                "offset": 0,
                                "dutyCycle": 0.5
                            }
                        },
                        "voltage": {
                            "processed": {
                                "label": "sinusoidal",
                                "peakToPeak": 10.0,
                                "offset": 0,
                                "dutyCycle": 0.5
                            }
                        }
                    }
                ]
            },
            {
                "name": "High Frequency 100kHz",
                "conditions": {
                    "ambientTemperature": 25
                },
                "excitationsPerWinding": [
                    {
                        "name": "Primary",
                        "frequency": 100000,
                        "current": {
                            "processed": {
                                "label": "sinusoidal",
                                "peakToPeak": 28.3,
                                "offset": 0,
                                "dutyCycle": 0.5
                            }
                        },
                        "voltage": {
                            "processed": {
                                "label": "sinusoidal",
                                "peakToPeak": 0.02,
                                "offset": 0,
                                "dutyCycle": 0.5
                            }
                        }
                    },
                    {
                        "name": "Secondary",
                        "frequency": 100000,
                        "current": {
                            "processed": {
                                "label": "sinusoidal",
                                "peakToPeak": 0.283,
                                "offset": 0,
                                "dutyCycle": 0.5
                            }
                        },
                        "voltage": {
                            "processed": {
                                "label": "sinusoidal",
                                "peakToPeak": 2.0,
                                "offset": 0,
                                "dutyCycle": 0.5
                            }
                        }
                    }
                ]
            }
        ]
    },
    "magnetic": {
        "core": {
            "name": "Toroid T 25.3/14.8/10 N30",
            "functionalDescription": {
                "type": "toroidal",
                "material": "N30",
                "shape": "T 25.3/14.8/10",
                "gapping": [],
                "numberStacks": 1
            }
        },
        "coil": {
            "bobbin": {
                "processedDescription": {
                    "wallThickness": 0,
                    "columnThickness": 0,
                    "columnDepth": 0.01,
                    "columnShape": "round",
                    "windingWindows": [
                        {
                            "height": 0.01,
                            "width": 0.00525,
                            "coordinates": [
                                0.00987,
                                0,
                                0
                            ]
                        }
                    ]
                }
            },
            "functionalDescription": [
                {
                    "name": "Primary",
                    "numberTurns": 1,
                    "numberParallels": 1,
                    "isolationSide": "primary",
                    "wire": "Round 6.0 - Grade 1"
                },
                {
                    "name": "Secondary",
                    "numberTurns": 100,
                    "numberParallels": 1,
                    "isolationSide": "secondary",
                    "wire": "Round 0.5 - Grade 1"
                }
            ]
        }
    },
    "outputs": []
}
