{
    "masVersion": "1.0.0",
    "inputs": {
        "designRequirements": {
            "name": "Active Clamp Forward Transformer 400V to 12V 5A",
            "magnetizingInductance": {
                "nominal": 0.0012,
                "minimum": 0.001,
                "maximum": 0.0014
            },
            "turnsRatios": [
                {
                    "nominal": 0.03,
                    "minimum": 0.028,
                    "maximum": 0.032
                }
            ],
            "leakageInductance": [
                {
                    "maximum": 5e-06
                }
            ],
            "topology": "activeClampForwardConverter",
            "operatingTemperature": {
                "maximum": 100
            },
            "insulation": {
                "insulationType": "reinforced",
                "overvoltageCategory": "II",
                "pollutionDegree": "PD2",
                "altitude": {
                    "maximum": 2000
                },
                "cti": "groupIIIA"
            },
            "maximumDimensions": {
                "width": 0.035,
                "height": 0.03,
                "depth": 0.028
            }
        },
        "operatingPoints": [
            {
                "name": "Nominal 230VAC",
                "conditions": {
                    "ambientTemperature": 40
                },
                "excitationsPerWinding": [
                    {
                        "name": "Primary",
                        "frequency": 200000,
                        "current": {
                            "processed": {
                                "label": "triangular",
                                "peakToPeak": 0.8,
                                "offset": 0.25,
                                "dutyCycle": 0.45
                            }
                        },
                        "voltage": {
                            "processed": {
                                "label": "rectangular",
                                "peakToPeak": 400,
                                "offset": 0,
                                "dutyCycle": 0.45
                            }
                        }
                    },
                    {
                        "name": "Secondary",
                        "frequency": 200000,
                        "current": {
                            "processed": {
                                "label": "rectangular",
                                "peakToPeak": 1.0,
                                "offset": 5.0,
                                "dutyCycle": 0.45
                            }
                        },
                        "voltage": {
                            "processed": {
                                "label": "rectangular",
                                "peakToPeak": 12,
                                "offset": 0,
                                "dutyCycle": 0.45
                            }
                        }
                    }
                ]
            }
        ]
    },
    "magnetic": {
        "core": {
            "name": "RM 10 N97 Gapped",
            "functionalDescription": {
                "type": "twoPieceSet",
                "material": "N97",
                "shape": "RM 10",
                "gapping": [
                    {
                        "type": "subtractive",
                        "length": 0.0003
                    },
                    {
                        "type": "residual",
                        "length": 1e-05
                    },
                    {
                        "type": "residual",
                        "length": 1e-05
                    }
                ],
                "numberStacks": 1
            }
        },
        "coil": {
            "bobbin": "RM 10",
            "functionalDescription": [
                {
                    "name": "Primary",
                    "numberTurns": 66,
                    "numberParallels": 1,
                    "isolationSide": "primary",
                    "wire": "Litz 20x0.1 - Grade 1"
                },
                {
                    "name": "Secondary",
                    "numberTurns": 2,
                    "numberParallels": 6,
                    "isolationSide": "secondary",
                    "wire": "Litz 100x0.1 - Grade 1"
                }
            ]
        }
    },
    "outputs": []
}
